{
  "$schema": "./pricing.schema.json",
  "source": "https://agentshortlist.com",
  "sourceRepo": "https://github.com/lucaspowell8020/agentshortlist",
  "verifiedDate": "2026-10-27",
  "verificationCadence": "daily",
  "verificationMethod": "Pricing is verified daily against vendor sources. Small drift (under 25% on input and output) is auto-applied; larger changes are reviewed by a human editor before publication. Vendor pricing pages are the canonical source of truth.",
  "license": "CC-BY-4.0",
  "models": [
    {
      "slug": "claude-fable-5",
      "name": "Claude Fable 5",
      "vendor": "Anthropic",
      "inputPricePerMillion": 10,
      "outputPricePerMillion": 50,
      "contextWindow": 1000000,
      "tier": "frontier"
    },
    {
      "slug": "claude-mythos-5",
      "name": "Claude Mythos 5",
      "vendor": "Anthropic",
      "inputPricePerMillion": 10,
      "outputPricePerMillion": 50,
      "contextWindow": 1000000,
      "tier": "frontier",
      "notes": "Limited-availability frontier model (Glasswing program). Same pricing as Fable 5. Not generally accessible — access via Anthropic's Glasswing program."
    },
    {
      "slug": "claude-opus-5",
      "name": "Claude Opus 5",
      "vendor": "Anthropic",
      "inputPricePerMillion": 5,
      "outputPricePerMillion": 25,
      "contextWindow": 1000000,
      "tier": "frontier",
      "notes": "Anthropic's current flagship reasoning model. Same $5/$25 pricing as the entire Opus 4.x line — no price bump for the generation upgrade. Best pick for the hardest agentic decisions where reasoning quality compounds."
    },
    {
      "slug": "claude-opus-5-fast",
      "name": "Claude Opus 5 Fast",
      "vendor": "Anthropic",
      "inputPricePerMillion": 10,
      "outputPricePerMillion": 50,
      "contextWindow": 1000000,
      "tier": "frontier",
      "notes": "Low-latency variant of Opus 5 — 2x the price for guaranteed throughput and faster time-to-first-token. Right pick for production agentic loops where latency matters more than cost."
    },
    {
      "slug": "claude-opus-4-8",
      "name": "Claude Opus 4.8",
      "vendor": "Anthropic",
      "inputPricePerMillion": 5,
      "outputPricePerMillion": 25,
      "contextWindow": 1000000,
      "tier": "frontier",
      "notes": "Previous flagship — superseded by Opus 5 at the same $5/$25 price. Still accessible via API for backwards compatibility. No reason to pick over Opus 5 unless you've pinned to this version."
    },
    {
      "slug": "claude-opus-4-8-fast",
      "name": "Claude Opus 4.8 Fast",
      "vendor": "Anthropic",
      "inputPricePerMillion": 10,
      "outputPricePerMillion": 50,
      "contextWindow": 1000000,
      "tier": "frontier",
      "notes": "Low-latency variant of Opus 4.8. Superseded by Opus 5 Fast at the same price. Right pick only if you've pinned to Opus 4.8 for other reasons."
    },
    {
      "slug": "claude-opus-4-7",
      "name": "Claude Opus 4.7",
      "vendor": "Anthropic",
      "inputPricePerMillion": 5,
      "outputPricePerMillion": 25,
      "contextWindow": 1000000,
      "tier": "frontier",
      "notes": "Previous flagship — superseded by Opus 4.8 (2026-05-28) at the same price. Still accessible via API for backwards compatibility."
    },
    {
      "slug": "claude-sonnet-5",
      "name": "Claude Sonnet 5",
      "vendor": "Anthropic",
      "inputPricePerMillion": 2,
      "outputPricePerMillion": 10,
      "contextWindow": 1000000,
      "tier": "balanced"
    },
    {
      "slug": "claude-sonnet-4-6",
      "name": "Claude Sonnet 4.6",
      "vendor": "Anthropic",
      "inputPricePerMillion": 3,
      "outputPricePerMillion": 15,
      "contextWindow": 1000000,
      "tier": "balanced"
    },
    {
      "slug": "claude-haiku-4-5",
      "name": "Claude Haiku 4.5",
      "vendor": "Anthropic",
      "inputPricePerMillion": 1,
      "outputPricePerMillion": 5,
      "contextWindow": 200000,
      "tier": "value",
      "notes": "Fast and cheap. Best for high-volume classification and short replies."
    },
    {
      "slug": "gpt-5",
      "name": "GPT-5.5",
      "vendor": "OpenAI",
      "inputPricePerMillion": 5,
      "outputPricePerMillion": 30,
      "contextWindow": 400000,
      "tier": "frontier",
      "notes": "OpenAI's frontier line. Marketed for coding and professional work."
    },
    {
      "slug": "gpt-5-4",
      "name": "GPT-5.4",
      "vendor": "OpenAI",
      "inputPricePerMillion": 2.5,
      "outputPricePerMillion": 15,
      "contextWindow": 1050000,
      "tier": "balanced",
      "notes": "The full GPT-5.4 — not the mini. Comparable pricing to Claude Sonnet with OpenAI's tool-use and computer-use stack."
    },
    {
      "slug": "gpt-5-mini",
      "name": "GPT-5.4 mini",
      "vendor": "OpenAI",
      "inputPricePerMillion": 0.75,
      "outputPricePerMillion": 4.5,
      "contextWindow": 128000,
      "tier": "value"
    },
    {
      "slug": "gpt-5-nano",
      "name": "GPT-5.4 nano",
      "vendor": "OpenAI",
      "inputPricePerMillion": 0.2,
      "outputPricePerMillion": 1.25,
      "contextWindow": 128000,
      "tier": "value"
    },
    {
      "slug": "gpt-5-3-codex",
      "name": "GPT-5.3 Codex",
      "vendor": "OpenAI",
      "inputPricePerMillion": 1.75,
      "outputPricePerMillion": 14,
      "contextWindow": 400000,
      "tier": "balanced",
      "notes": "OpenAI's coding-specific model — powers the Codex CLI and ChatGPT cloud-runner agent. Tuned for software engineering tasks; competitive with Claude Sonnet on coding-only benchmarks at lower input cost."
    },
    {
      "slug": "grok-4-5",
      "name": "Grok 4.5",
      "vendor": "xAI",
      "inputPricePerMillion": 2,
      "outputPricePerMillion": 6,
      "contextWindow": 500000,
      "tier": "frontier"
    },
    {
      "slug": "grok-4-3",
      "name": "Grok 4.3",
      "vendor": "xAI",
      "inputPricePerMillion": 1.25,
      "outputPricePerMillion": 2.5,
      "contextWindow": 1000000,
      "tier": "frontier"
    },
    {
      "slug": "grok-build-0-1",
      "name": "Grok Build 0.1",
      "vendor": "xAI",
      "inputPricePerMillion": 1,
      "outputPricePerMillion": 2,
      "contextWindow": 256000,
      "tier": "value"
    },
    {
      "slug": "gemini-2-5-pro",
      "name": "Gemini 2.5 Pro",
      "vendor": "Google",
      "inputPricePerMillion": 1.25,
      "outputPricePerMillion": 10,
      "contextWindow": 2000000,
      "tier": "balanced",
      "notes": "Largest context window on the list. Pricing shown is for prompts ≤200k tokens; rises to $2.50/$15 above that."
    },
    {
      "slug": "gemini-2-5-flash",
      "name": "Gemini 2.5 Flash",
      "vendor": "Google",
      "inputPricePerMillion": 0.3,
      "outputPricePerMillion": 2.5,
      "contextWindow": 1000000,
      "tier": "value",
      "notes": "Hybrid reasoning model with 1M context and tunable thinking budgets."
    },
    {
      "slug": "gemini-3-5-flash",
      "name": "Gemini 3.5 Flash",
      "vendor": "Google",
      "inputPricePerMillion": 1.5,
      "outputPricePerMillion": 9,
      "contextWindow": 1000000,
      "tier": "balanced"
    },
    {
      "slug": "gemini-3-1-pro-preview",
      "name": "Gemini 3.1 Pro Preview",
      "vendor": "Google",
      "inputPricePerMillion": 2,
      "outputPricePerMillion": 12,
      "contextWindow": 2000000,
      "tier": "balanced"
    },
    {
      "slug": "gemini-3-flash-preview",
      "name": "Gemini 3 Flash Preview",
      "vendor": "Google",
      "inputPricePerMillion": 0.5,
      "outputPricePerMillion": 3,
      "contextWindow": 1000000,
      "tier": "balanced",
      "notes": "Google's high-speed thinking model for agentic workflows. Strong on coding and multi-turn chat. Top 5 on public model marketplaces this week."
    },
    {
      "slug": "gemini-3-1-flash-lite-preview",
      "name": "Gemini 3.1 Flash-Lite Preview",
      "vendor": "Google",
      "inputPricePerMillion": 0.25,
      "outputPricePerMillion": 1.5,
      "contextWindow": 1000000,
      "tier": "value",
      "notes": "Google's most cost-efficient model. Optimised for high-volume agentic tasks and simple data processing."
    },
    {
      "slug": "llama-3-3-70b",
      "name": "Llama 3.3 70B (Together AI)",
      "vendor": "Meta / Together AI",
      "inputPricePerMillion": 0.88,
      "outputPricePerMillion": 0.88,
      "contextWindow": 128000,
      "tier": "value",
      "notes": "Open weights. The price shown reflects Together AI; other inference providers host the same weights at different rates."
    },
    {
      "slug": "deepseek-v4-flash",
      "name": "DeepSeek V4 Flash",
      "vendor": "DeepSeek",
      "inputPricePerMillion": 0.0419,
      "outputPricePerMillion": 0.0837,
      "contextWindow": 128000,
      "tier": "value",
      "notes": "DeepSeek's value tier. Cache-hit pricing drops input to $0.0028/M on repeat queries."
    },
    {
      "slug": "deepseek-v3-2",
      "name": "DeepSeek V3.2",
      "vendor": "DeepSeek",
      "inputPricePerMillion": 0.28,
      "outputPricePerMillion": 0.42,
      "contextWindow": 131000,
      "tier": "value",
      "notes": "DeepSeek's capable open-weight model. Extraordinary value — frontier-class performance at $0.25/M input. Top 3 on public model marketplaces this week."
    },
    {
      "slug": "kimi-k2-7-code",
      "name": "Kimi K2.7 Code",
      "vendor": "Moonshot AI",
      "inputPricePerMillion": 0.6725,
      "outputPricePerMillion": 3.1,
      "contextWindow": 262000,
      "tier": "value"
    },
    {
      "slug": "kimi-k2-6",
      "name": "Kimi K2.6",
      "vendor": "Moonshot AI",
      "inputPricePerMillion": 0.4342,
      "outputPricePerMillion": 1.828,
      "contextWindow": 256000,
      "tier": "balanced"
    },
    {
      "slug": "glm-5-2",
      "name": "GLM 5.2",
      "vendor": "z.ai",
      "inputPricePerMillion": 0.62,
      "outputPricePerMillion": 2.42,
      "contextWindow": 1048000,